{
  "$schema": "https://json-schema.org/draft/2020-12/schema",
  "$id": "https://pmdneo.example/schemas/ir-v0.1.json",
  "title": "PMDNEO Intermediate Register Command Data (IR) v0.1",
  "description": "PMDNEO compiler / WebApp intermediate format. ADR-0034 ratified (= 24th session 2026-05-17). IR は Z80 driver runtime ではなく authoring / build pipeline / diagnostics 用の正規化形式。 canonical serialization は JSON、 binary は scope-out (= 軸 2 ratify)。 3 層 hybrid (= SemanticEvent / ChipEvent / RawRegisterWrite、 軸 3 ratify)。 v0.1 で fully validated な event 種は 6 件 = Note / Rest / Tempo / ToneSelect / ADPCMATrigger / RawRegisterWrite。 他 event 種 (= KeyOn / KeyOff / FMToneLoad / FMFrequency / FM3Mode / ADPCMBDma / Volume / Pan / LoopStart / LoopEnd) は v0.2 以降。",
  "type": "object",
  "additionalProperties": false,
  "required": ["metadata", "targetProfile", "timing", "channels", "events"],
  "properties": {
    "$schema": {
      "type": "string",
      "description": "example file が schema 参照のために含める optional field。 IR 本体 spec の一部ではない。"
    },
    "metadata": { "$ref": "#/$defs/Metadata" },
    "targetProfile": { "$ref": "#/$defs/TargetProfile" },
    "timing": { "$ref": "#/$defs/Timing" },
    "channels": {
      "type": "array",
      "items": { "$ref": "#/$defs/ChannelDecl" }
    },
    "tones": {
      "type": "array",
      "items": { "$ref": "#/$defs/FMTone" }
    },
    "sampleRefs": {
      "type": "array",
      "items": { "$ref": "#/$defs/SampleRef" }
    },
    "events": {
      "type": "array",
      "items": { "$ref": "#/$defs/Event" }
    },
    "diagnostics": {
      "type": "array",
      "items": { "$ref": "#/$defs/Diagnostic" }
    }
  },
  "$defs": {
    "Metadata": {
      "type": "object",
      "additionalProperties": false,
      "required": ["magic", "version", "sourceDialect", "createdBy"],
      "properties": {
        "magic": {
          "const": "PMDNEO-IR",
          "description": "IR document magic. 常に PMDNEO-IR。"
        },
        "version": {
          "type": "integer",
          "minimum": 1,
          "description": "IR schema major version。 v0.1 では 1。 schema が non-backwards-compat 変更を受けたら bump。"
        },
        "sourceDialect": {
          "$ref": "#/$defs/SourceDialect"
        },
        "createdBy": {
          "type": "string",
          "description": "生成 tool 名 + version。 例: 'pmdneo-compiler v0.0.1'"
        },
        "sourceHash": {
          "type": "string",
          "description": "入力 file の hash (= optional、 source 追跡用)"
        }
      }
    },
    "SourceDialect": {
      "enum": ["pmd", "mewmml", "mdx", "mucom88", "fmp7", "unknown"]
    },
    "TargetProfile": {
      "enum": ["ym2610_aes", "ym2610b", "opna_compat"],
      "description": "対象 chip profile。 ym2610_aes は FM ch 1/4 mute warning、 ym2610b は 6 ch 全 audible、 opna_compat は K/R rhythm 検証用。"
    },
    "Timing": {
      "type": "object",
      "additionalProperties": false,
      "required": ["ticksPerBeat"],
      "properties": {
        "ticksPerBeat": {
          "type": "integer",
          "minimum": 1,
          "description": "PPQN (= Pulses Per Quarter Note)。 PMDNEO IR の標準は 192。"
        },
        "timeMode": {
          "enum": ["absolute", "delta"],
          "default": "absolute",
          "description": "IR 内部は absolute tick を正規形とする。 delta は import 時のみ許容。"
        },
        "tempoBase": {
          "type": "number",
          "exclusiveMinimum": 0,
          "description": "初期 BPM。"
        },
        "swing": {
          "type": "object",
          "description": "v0.1 では非標準。 拡張のための placeholder。"
        }
      }
    },
    "ChannelId": {
      "type": "object",
      "additionalProperties": false,
      "required": ["kind", "index"],
      "properties": {
        "kind": {
          "enum": ["fm", "ssg", "adpcm_a", "adpcm_b", "rhythm_kr"],
          "description": "channel 種別。 fm 1-6 / ssg 1-3 / adpcm_a 1-6 / adpcm_b 1 / rhythm_kr 1。"
        },
        "index": {
          "type": "integer",
          "minimum": 1,
          "maximum": 6,
          "description": "channel index。 kind に応じて有効範囲が変わる。"
        }
      }
    },
    "ChannelDecl": {
      "type": "object",
      "additionalProperties": false,
      "required": ["channelId"],
      "properties": {
        "channelId": { "$ref": "#/$defs/ChannelId" },
        "name": {
          "type": "string",
          "description": "channel の人間可読 name (= 例 'Part B FM2')。 optional。"
        }
      }
    },
    "FMTone": {
      "type": "object",
      "additionalProperties": false,
      "required": ["toneId", "algorithm", "feedback", "operators"],
      "properties": {
        "toneId": {
          "type": "integer",
          "minimum": 0,
          "description": "tone_bank 内 id。 ToneSelect / FMToneLoad event から参照される。"
        },
        "algorithm": {
          "type": "integer",
          "minimum": 0,
          "maximum": 7,
          "description": "FM algorithm (AL)。 8 種 topology。"
        },
        "feedback": {
          "type": "integer",
          "minimum": 0,
          "maximum": 7,
          "description": "op1 self-feedback (FB)。 0 = なし、 6-7 で激変。"
        },
        "operators": {
          "type": "array",
          "minItems": 4,
          "maxItems": 4,
          "items": { "$ref": "#/$defs/FMOperator" },
          "description": "operator 1-4 の parameter (= 4 件固定)。"
        }
      }
    },
    "FMOperator": {
      "type": "object",
      "additionalProperties": false,
      "required": ["ar", "dr", "sr", "rr", "sl", "tl", "ks", "mul", "dt"],
      "properties": {
        "ar": { "type": "integer", "minimum": 0, "maximum": 31, "description": "Attack Rate" },
        "dr": { "type": "integer", "minimum": 0, "maximum": 31, "description": "Decay Rate" },
        "sr": { "type": "integer", "minimum": 0, "maximum": 31, "description": "Sustain Rate" },
        "rr": { "type": "integer", "minimum": 0, "maximum": 15, "description": "Release Rate" },
        "sl": { "type": "integer", "minimum": 0, "maximum": 15, "description": "Sustain Level" },
        "tl": { "type": "integer", "minimum": 0, "maximum": 127, "description": "Total Level (= 0.75 dB/step 対数減衰)" },
        "ks": { "type": "integer", "minimum": 0, "maximum": 3, "description": "Key Scale" },
        "mul": { "type": "integer", "minimum": 0, "maximum": 15, "description": "Multiple (= 周波数倍率)" },
        "dt": { "type": "integer", "minimum": -3, "maximum": 3, "description": "Detune" },
        "am": { "type": "boolean", "default": false, "description": "AM enable" },
        "ssgEg": { "type": "integer", "minimum": 0, "maximum": 15, "description": "SSG-EG mode" }
      }
    },
    "SampleRef": {
      "type": "object",
      "additionalProperties": false,
      "required": ["sampleRef", "kind"],
      "properties": {
        "sampleRef": {
          "type": "integer",
          "minimum": 0,
          "description": "IR 内 sample id。 ADPCMATrigger / ADPCMBDma event から参照される。"
        },
        "kind": {
          "enum": ["adpcm_a", "adpcm_b"],
          "description": "sample 種別。"
        },
        "packFile": {
          "type": "string",
          "description": "対応する pack file 名 (= 例 'step5.PNE')。 optional。"
        },
        "slot": {
          "type": "integer",
          "minimum": 0,
          "description": "ADPCM-A slot index。 optional。"
        },
        "name": {
          "type": "string",
          "description": "sample 名 (= 例 'bd', 'sd')。 optional。"
        },
        "sourceUri": {
          "type": "string",
          "description": "converter 入力追跡用 URI (= 例 'file://samples/bd.wav')。 optional。 IR の sample provenance は lightweight handle (= ADR-0034 決定 5)。 詳細 provenance は .PNE / .NEO 側。"
        }
      }
    },
    "SourceRef": {
      "type": "object",
      "additionalProperties": false,
      "required": ["dialect"],
      "properties": {
        "dialect": { "$ref": "#/$defs/SourceDialect" },
        "file": { "type": "string" },
        "line": { "type": "integer", "minimum": 1 },
        "column": { "type": "integer", "minimum": 1 },
        "rawCommand": { "type": "string" }
      }
    },
    "LossyFlag": {
      "enum": [
        "pitch_approx",
        "lfo_approx",
        "tone_approx",
        "channel_muted",
        "unsupported_effect",
        "timing_quantized"
      ]
    },
    "Diagnostic": {
      "type": "object",
      "additionalProperties": false,
      "required": ["id", "severity"],
      "properties": {
        "id": {
          "type": "string",
          "pattern": "^IR\\d{3,}$",
          "description": "validation rule id (= 例 'IR001', 'IR005')。"
        },
        "severity": {
          "enum": ["error", "warning", "info"]
        },
        "message": { "type": "string" },
        "relatedTick": { "type": "integer", "minimum": 0 },
        "relatedTrackId": { "type": "integer", "minimum": 0 }
      }
    },
    "EventCommon": {
      "type": "object",
      "required": ["tick", "order", "layer", "type"],
      "properties": {
        "tick": {
          "type": "integer",
          "minimum": 0,
          "description": "absolute tick position。"
        },
        "order": {
          "type": "integer",
          "minimum": 0,
          "description": "同一 tick 内の event 順序 (= track 内で 0 から増加)。"
        },
        "trackId": {
          "type": "integer",
          "minimum": 0,
          "description": "logical track id。"
        },
        "layer": {
          "enum": ["semantic", "chip", "raw"],
          "description": "ADR-0034 決定 3 の 3 層 hybrid discriminator。"
        },
        "type": {
          "type": "string",
          "description": "event 種別 (= layer ごとに固定値 const、 v0.1 fully validated 6 件)。"
        },
        "source": { "$ref": "#/$defs/SourceRef" },
        "lossyFlags": {
          "type": "array",
          "items": { "$ref": "#/$defs/LossyFlag" }
        }
      }
    },
    "Event": {
      "oneOf": [
        { "$ref": "#/$defs/NoteEvent" },
        { "$ref": "#/$defs/RestEvent" },
        { "$ref": "#/$defs/TempoEvent" },
        { "$ref": "#/$defs/ToneSelectEvent" },
        { "$ref": "#/$defs/ADPCMATriggerEvent" },
        { "$ref": "#/$defs/RawRegisterWriteEvent" }
      ],
      "description": "v0.1 で fully validated な event 種 6 件の discriminated union。 layer + type 組み合わせで一意に決まる。 他 event 種 (= KeyOn / KeyOff / FMToneLoad / FMFrequency / FM3Mode / ADPCMBDma / Volume / Pan / LoopStart / LoopEnd) は v0.2 以降で追加。"
    },
    "NoteEvent": {
      "allOf": [{ "$ref": "#/$defs/EventCommon" }],
      "type": "object",
      "unevaluatedProperties": false,
      "required": ["channel", "note", "duration"],
      "properties": {
        "layer": { "const": "semantic" },
        "type": { "const": "Note" },
        "channel": { "$ref": "#/$defs/ChannelId" },
        "note": {
          "type": "integer",
          "minimum": 0,
          "maximum": 127,
          "description": "MIDI note number。 60 = MIDI C4 = PMD o5 c (= memory project_pmd_voice_ml_verified)。"
        },
        "duration": {
          "type": "integer",
          "minimum": 0,
          "description": "tick 単位の note 長。"
        },
        "gate": {
          "type": "integer",
          "minimum": 0,
          "description": "実発音 tick。 省略時は duration と同値。"
        },
        "velocity": {
          "type": "integer",
          "minimum": 0,
          "maximum": 127,
          "description": "0-127 normalized velocity。"
        },
        "tie": { "type": "boolean" }
      }
    },
    "RestEvent": {
      "allOf": [{ "$ref": "#/$defs/EventCommon" }],
      "type": "object",
      "unevaluatedProperties": false,
      "required": ["channel", "duration"],
      "properties": {
        "layer": { "const": "semantic" },
        "type": { "const": "Rest" },
        "channel": { "$ref": "#/$defs/ChannelId" },
        "duration": {
          "type": "integer",
          "minimum": 0,
          "description": "tick 単位の rest 長。"
        }
      }
    },
    "TempoEvent": {
      "allOf": [{ "$ref": "#/$defs/EventCommon" }],
      "type": "object",
      "unevaluatedProperties": false,
      "required": ["bpm"],
      "properties": {
        "layer": { "const": "semantic" },
        "type": { "const": "Tempo" },
        "bpm": {
          "type": "number",
          "exclusiveMinimum": 0,
          "description": "BPM (= beats per minute)。"
        }
      }
    },
    "ToneSelectEvent": {
      "allOf": [{ "$ref": "#/$defs/EventCommon" }],
      "type": "object",
      "unevaluatedProperties": false,
      "required": ["channel", "toneId"],
      "properties": {
        "layer": { "const": "semantic" },
        "type": { "const": "ToneSelect" },
        "channel": { "$ref": "#/$defs/ChannelId" },
        "toneId": {
          "type": "integer",
          "minimum": 0,
          "description": "tones 配列内の toneId 参照。"
        }
      }
    },
    "ADPCMATriggerEvent": {
      "allOf": [{ "$ref": "#/$defs/EventCommon" }],
      "type": "object",
      "unevaluatedProperties": false,
      "required": ["channel", "sampleRef", "volume", "panLeft", "panRight"],
      "properties": {
        "layer": { "const": "chip" },
        "type": { "const": "ADPCMATrigger" },
        "channel": { "$ref": "#/$defs/ChannelId" },
        "sampleRef": {
          "type": "integer",
          "minimum": 0,
          "description": "sampleRefs 配列内の sampleRef 参照。"
        },
        "volume": {
          "type": "integer",
          "minimum": 0,
          "maximum": 31,
          "description": "ADPCM-A volume 0-31 (= 5-bit)。"
        },
        "panLeft": { "type": "boolean" },
        "panRight": { "type": "boolean" }
      }
    },
    "RawRegisterWriteEvent": {
      "allOf": [{ "$ref": "#/$defs/EventCommon" }],
      "type": "object",
      "unevaluatedProperties": false,
      "required": ["port", "address", "data"],
      "properties": {
        "layer": { "const": "raw" },
        "type": { "const": "RawRegisterWrite" },
        "port": {
          "type": "integer",
          "minimum": 0,
          "maximum": 1,
          "description": "0 = port 0 (= address/data port 0、 FM ch 1-3 + 共通)、 1 = port 1 (= FM ch 4-6)。"
        },
        "address": {
          "type": "integer",
          "minimum": 0,
          "maximum": 255,
          "description": "register address 0x00-0xFF。"
        },
        "data": {
          "type": "integer",
          "minimum": 0,
          "maximum": 255,
          "description": "write data 0x00-0xFF。"
        },
        "barrier": {
          "type": "boolean",
          "description": "true なら前後の並べ替え禁止 + 最適化対象外。"
        }
      }
    }
  }
}
