{
  "metadata": {
    "magic": "PMDNEO-IR",
    "version": 1,
    "sourceDialect": "pmd",
    "createdBy": "ir-lower-raw-register-spike v0.2 (= 26th session β、 IR v0.2 ChipEvent -> v0.2 RawRegisterWrite lowering) (= lowered from: ir-lower-chipevent-spike v0.2 (= 25th session β、 IR v0.1 SemanticEvent -> v0.2 ChipEvent lowering) (= lowered from: mml-to-ir-spike v0.1 (= 24th session、 ADR-0034 ratify 後)))"
  },
  "targetProfile": "ym2610_aes",
  "timing": {
    "ticksPerBeat": 192,
    "timeMode": "absolute",
    "tempoBase": 120.0
  },
  "channels": [
    {
      "channelId": {
        "kind": "fm",
        "index": 2
      },
      "name": "Part B FM2"
    }
  ],
  "events": [
    {
      "tick": 0,
      "order": 0,
      "trackId": 0,
      "layer": "semantic",
      "type": "Tempo",
      "bpm": 120.0
    },
    {
      "tick": 0,
      "order": 1,
      "trackId": 0,
      "layer": "raw",
      "type": "RawRegisterWrite",
      "port": 0,
      "address": 49,
      "data": 49
    },
    {
      "tick": 0,
      "order": 2,
      "trackId": 0,
      "layer": "raw",
      "type": "RawRegisterWrite",
      "port": 0,
      "address": 57,
      "data": 52
    },
    {
      "tick": 0,
      "order": 3,
      "trackId": 0,
      "layer": "raw",
      "type": "RawRegisterWrite",
      "port": 0,
      "address": 53,
      "data": 49
    },
    {
      "tick": 0,
      "order": 4,
      "trackId": 0,
      "layer": "raw",
      "type": "RawRegisterWrite",
      "port": 0,
      "address": 61,
      "data": 49
    },
    {
      "tick": 0,
      "order": 5,
      "trackId": 0,
      "layer": "raw",
      "type": "RawRegisterWrite",
      "port": 0,
      "address": 65,
      "data": 35
    },
    {
      "tick": 0,
      "order": 6,
      "trackId": 0,
      "layer": "raw",
      "type": "RawRegisterWrite",
      "port": 0,
      "address": 73,
      "data": 20
    },
    {
      "tick": 0,
      "order": 7,
      "trackId": 0,
      "layer": "raw",
      "type": "RawRegisterWrite",
      "port": 0,
      "address": 69,
      "data": 35
    },
    {
      "tick": 0,
      "order": 8,
      "trackId": 0,
      "layer": "raw",
      "type": "RawRegisterWrite",
      "port": 0,
      "address": 77,
      "data": 0
    },
    {
      "tick": 0,
      "order": 9,
      "trackId": 0,
      "layer": "raw",
      "type": "RawRegisterWrite",
      "port": 0,
      "address": 81,
      "data": 31
    },
    {
      "tick": 0,
      "order": 10,
      "trackId": 0,
      "layer": "raw",
      "type": "RawRegisterWrite",
      "port": 0,
      "address": 89,
      "data": 25
    },
    {
      "tick": 0,
      "order": 11,
      "trackId": 0,
      "layer": "raw",
      "type": "RawRegisterWrite",
      "port": 0,
      "address": 85,
      "data": 31
    },
    {
      "tick": 0,
      "order": 12,
      "trackId": 0,
      "layer": "raw",
      "type": "RawRegisterWrite",
      "port": 0,
      "address": 93,
      "data": 25
    },
    {
      "tick": 0,
      "order": 13,
      "trackId": 0,
      "layer": "raw",
      "type": "RawRegisterWrite",
      "port": 0,
      "address": 97,
      "data": 14
    },
    {
      "tick": 0,
      "order": 14,
      "trackId": 0,
      "layer": "raw",
      "type": "RawRegisterWrite",
      "port": 0,
      "address": 105,
      "data": 5
    },
    {
      "tick": 0,
      "order": 15,
      "trackId": 0,
      "layer": "raw",
      "type": "RawRegisterWrite",
      "port": 0,
      "address": 101,
      "data": 14
    },
    {
      "tick": 0,
      "order": 16,
      "trackId": 0,
      "layer": "raw",
      "type": "RawRegisterWrite",
      "port": 0,
      "address": 109,
      "data": 5
    },
    {
      "tick": 0,
      "order": 17,
      "trackId": 0,
      "layer": "raw",
      "type": "RawRegisterWrite",
      "port": 0,
      "address": 113,
      "data": 0
    },
    {
      "tick": 0,
      "order": 18,
      "trackId": 0,
      "layer": "raw",
      "type": "RawRegisterWrite",
      "port": 0,
      "address": 121,
      "data": 0
    },
    {
      "tick": 0,
      "order": 19,
      "trackId": 0,
      "layer": "raw",
      "type": "RawRegisterWrite",
      "port": 0,
      "address": 117,
      "data": 0
    },
    {
      "tick": 0,
      "order": 20,
      "trackId": 0,
      "layer": "raw",
      "type": "RawRegisterWrite",
      "port": 0,
      "address": 125,
      "data": 0
    },
    {
      "tick": 0,
      "order": 21,
      "trackId": 0,
      "layer": "raw",
      "type": "RawRegisterWrite",
      "port": 0,
      "address": 129,
      "data": 23
    },
    {
      "tick": 0,
      "order": 22,
      "trackId": 0,
      "layer": "raw",
      "type": "RawRegisterWrite",
      "port": 0,
      "address": 137,
      "data": 37
    },
    {
      "tick": 0,
      "order": 23,
      "trackId": 0,
      "layer": "raw",
      "type": "RawRegisterWrite",
      "port": 0,
      "address": 133,
      "data": 23
    },
    {
      "tick": 0,
      "order": 24,
      "trackId": 0,
      "layer": "raw",
      "type": "RawRegisterWrite",
      "port": 0,
      "address": 141,
      "data": 37
    },
    {
      "tick": 0,
      "order": 25,
      "trackId": 0,
      "layer": "raw",
      "type": "RawRegisterWrite",
      "port": 0,
      "address": 145,
      "data": 0
    },
    {
      "tick": 0,
      "order": 26,
      "trackId": 0,
      "layer": "raw",
      "type": "RawRegisterWrite",
      "port": 0,
      "address": 153,
      "data": 0
    },
    {
      "tick": 0,
      "order": 27,
      "trackId": 0,
      "layer": "raw",
      "type": "RawRegisterWrite",
      "port": 0,
      "address": 149,
      "data": 0
    },
    {
      "tick": 0,
      "order": 28,
      "trackId": 0,
      "layer": "raw",
      "type": "RawRegisterWrite",
      "port": 0,
      "address": 157,
      "data": 0
    },
    {
      "tick": 0,
      "order": 29,
      "trackId": 0,
      "layer": "raw",
      "type": "RawRegisterWrite",
      "port": 0,
      "address": 177,
      "data": 44
    },
    {
      "tick": 0,
      "order": 30,
      "trackId": 0,
      "layer": "raw",
      "type": "RawRegisterWrite",
      "port": 0,
      "address": 165,
      "data": 34
    },
    {
      "tick": 0,
      "order": 31,
      "trackId": 0,
      "layer": "raw",
      "type": "RawRegisterWrite",
      "port": 0,
      "address": 161,
      "data": 105
    },
    {
      "tick": 0,
      "order": 32,
      "trackId": 0,
      "layer": "raw",
      "type": "RawRegisterWrite",
      "port": 0,
      "address": 40,
      "data": 241
    },
    {
      "tick": 192,
      "order": 0,
      "trackId": 0,
      "layer": "raw",
      "type": "RawRegisterWrite",
      "port": 0,
      "address": 40,
      "data": 1
    },
    {
      "tick": 384,
      "order": 0,
      "trackId": 0,
      "layer": "raw",
      "type": "RawRegisterWrite",
      "port": 0,
      "address": 165,
      "data": 35
    },
    {
      "tick": 384,
      "order": 1,
      "trackId": 0,
      "layer": "raw",
      "type": "RawRegisterWrite",
      "port": 0,
      "address": 161,
      "data": 10
    },
    {
      "tick": 384,
      "order": 2,
      "trackId": 0,
      "layer": "raw",
      "type": "RawRegisterWrite",
      "port": 0,
      "address": 40,
      "data": 241
    },
    {
      "tick": 576,
      "order": 0,
      "trackId": 0,
      "layer": "raw",
      "type": "RawRegisterWrite",
      "port": 0,
      "address": 40,
      "data": 1
    }
  ],
  "tones": [
    {
      "toneId": 0,
      "algorithm": 4,
      "feedback": 5,
      "operators": [
        {
          "ar": 31,
          "dr": 14,
          "sr": 0,
          "rr": 7,
          "sl": 1,
          "tl": 35,
          "ks": 0,
          "mul": 1,
          "dt": 0,
          "am": false,
          "ssgEg": 0
        },
        {
          "ar": 25,
          "dr": 5,
          "sr": 0,
          "rr": 5,
          "sl": 2,
          "tl": 20,
          "ks": 0,
          "mul": 4,
          "dt": 0,
          "am": false,
          "ssgEg": 0
        },
        {
          "ar": 31,
          "dr": 14,
          "sr": 0,
          "rr": 7,
          "sl": 1,
          "tl": 35,
          "ks": 0,
          "mul": 1,
          "dt": 0,
          "am": false,
          "ssgEg": 0
        },
        {
          "ar": 25,
          "dr": 5,
          "sr": 0,
          "rr": 5,
          "sl": 2,
          "tl": 0,
          "ks": 0,
          "mul": 1,
          "dt": 0,
          "am": false,
          "ssgEg": 0
        }
      ]
    }
  ]
}
