{
  "metadata": {
    "magic": "PMDNEO-IR",
    "version": 1,
    "sourceDialect": "unknown",
    "createdBy": "PMDNEO IR v0.1 spike fixture: unsorted-events (= 25th session PR #4 review finding 4 reproduction、 array 配列順を意図的に (tick, order) と逆にした valid v0.1 IR、 spike が array 順ではなく (tick, order) を semantic 真の順序として処理することを literal 確認するための fixture)"
  },
  "targetProfile": "ym2610b",
  "timing": {
    "ticksPerBeat": 192,
    "timeMode": "absolute"
  },
  "channels": [
    { "channelId": { "kind": "fm", "index": 2 } }
  ],
  "events": [
    {
      "tick": 0,
      "order": 9,
      "trackId": 0,
      "layer": "raw",
      "type": "RawRegisterWrite",
      "port": 0,
      "address": 39,
      "data": 192
    },
    {
      "tick": 0,
      "order": 0,
      "trackId": 0,
      "layer": "semantic",
      "type": "Tempo",
      "bpm": 120.0
    },
    {
      "tick": 0,
      "order": 5,
      "trackId": 0,
      "layer": "semantic",
      "type": "ToneSelect",
      "channel": { "kind": "fm", "index": 2 },
      "toneId": 0
    }
  ]
}
